{
  "schema_version": "steam-visual-transition-review/v0.1",
  "packet_id": "targeted-transition-review-v1",
  "packet_sha256": "2772aa3ce59da9db0e2b02930849bef25684a37bb473c0c4ad7bcd4b24b2d9a3",
  "output_contract": "outcome_blind_visual_evidence_only",
  "items": [
    {
      "item_id": "transition-review:24533b7f12c28a0865aab8fb",
      "coverage": "partial",
      "visual_evidence": [
        {
          "asset_id": "visual:3fc8b234ab99f72a2aa1fc28",
          "node_id": "event:atomic:memory:vh_seg_001:003",
          "roles": [
            "source"
          ],
          "video_id": "0jq3JQ9YTqg",
          "start_s": 12.0,
          "end_s": 16.0,
          "media_url": "/api/media/visual:3fc8b234ab99f72a2aa1fc28",
          "availability": "available",
          "missing_reason": null
        },
        {
          "asset_id": "visual:b8a67bc2336c9e1dd77d0f37",
          "node_id": "event:atomic:memory:vh_seg_002:005",
          "roles": [
            "target",
            "observation"
          ],
          "video_id": "0jq3JQ9YTqg",
          "start_s": 52.0,
          "end_s": 55.0,
          "media_url": "/api/media/visual:b8a67bc2336c9e1dd77d0f37",
          "availability": "available",
          "missing_reason": null
        },
        {
          "asset_id": "visual:1a21e905ee44dbf5c498107e",
          "node_id": "memory:vh_seg_001",
          "roles": [
            "target",
            "observation"
          ],
          "video_id": "0jq3JQ9YTqg",
          "start_s": 3.0,
          "end_s": 45.0,
          "media_url": "/api/media/visual:1a21e905ee44dbf5c498107e",
          "availability": "available",
          "missing_reason": null
        },
        {
          "asset_id": "visual:78be002faf6c8a405c845bca",
          "node_id": "memory:vh_seg_002",
          "roles": [
            "target",
            "observation"
          ],
          "video_id": "0jq3JQ9YTqg",
          "start_s": 45.0,
          "end_s": 75.0,
          "media_url": "/api/media/visual:78be002faf6c8a405c845bca",
          "availability": "partial",
          "missing_reason": "video_window_exceeds_duration"
        }
      ]
    },
    {
      "item_id": "transition-review:279763af199b582abbdb726c",
      "coverage": "full",
      "visual_evidence": [
        {
          "asset_id": "visual:2ac06e0353ccd6bee1fd38b0",
          "node_id": "event:atomic:memory:vh_seg_002:005",
          "roles": [
            "source"
          ],
          "video_id": "0-kQB8Jo80I",
          "start_s": 54.0,
          "end_s": 56.0,
          "media_url": "/api/media/visual:2ac06e0353ccd6bee1fd38b0",
          "availability": "available",
          "missing_reason": null
        },
        {
          "asset_id": "visual:aea3cb5059110969b83f9223",
          "node_id": "event:atomic:memory:vh_seg_002:006",
          "roles": [
            "target",
            "observation"
          ],
          "video_id": "0-kQB8Jo80I",
          "start_s": 56.0,
          "end_s": 58.0,
          "media_url": "/api/media/visual:aea3cb5059110969b83f9223",
          "availability": "available",
          "missing_reason": null
        }
      ]
    },
    {
      "item_id": "transition-review:1e8dcc9b1c287427ff1b1da3",
      "coverage": "full",
      "visual_evidence": [
        {
          "asset_id": "visual:43562f31ad682e032f02d143",
          "node_id": "event:atomic:video_skills_l1:00013",
          "roles": [
            "target"
          ],
          "video_id": "mKqiGQrHtW8",
          "start_s": 6.0,
          "end_s": 10.0,
          "media_url": "/api/media/visual:43562f31ad682e032f02d143",
          "availability": "available",
          "missing_reason": null
        },
        {
          "asset_id": "visual:73c1c55283906ea7ab0f5cec",
          "node_id": "event:atomic:video_skills_l1:00021",
          "roles": [
            "target"
          ],
          "video_id": "mKqiGQrHtW8",
          "start_s": 12.0,
          "end_s": 16.0,
          "media_url": "/api/media/visual:73c1c55283906ea7ab0f5cec",
          "availability": "available",
          "missing_reason": null
        },
        {
          "asset_id": "visual:3b4f9fd58277a6eaecc80194",
          "node_id": "event:atomic:video_skills_l1:00081",
          "roles": [
            "target"
          ],
          "video_id": "mKqiGQrHtW8",
          "start_s": 51.0,
          "end_s": 55.0,
          "media_url": "/api/media/visual:3b4f9fd58277a6eaecc80194",
          "availability": "available",
          "missing_reason": null
        }
      ]
    },
    {
      "item_id": "transition-review:36a546ff6da54ecb5e0fa455",
      "coverage": "full",
      "visual_evidence": [
        {
          "asset_id": "visual:9c68cbaa8d45833881d07cc7",
          "node_id": "event:atomic:memory:vh_seg_003:001",
          "roles": [
            "source"
          ],
          "video_id": "-3l2KFTj7yY",
          "start_s": 71.0,
          "end_s": 78.0,
          "media_url": "/api/media/visual:9c68cbaa8d45833881d07cc7",
          "availability": "available",
          "missing_reason": null
        },
        {
          "asset_id": "visual:f82c7b4a2bf7229bf3aa805a",
          "node_id": "event:atomic:memory:vh_seg_003:004",
          "roles": [
            "target",
            "observation"
          ],
          "video_id": "-3l2KFTj7yY",
          "start_s": 82.0,
          "end_s": 84.0,
          "media_url": "/api/media/visual:f82c7b4a2bf7229bf3aa805a",
          "availability": "available",
          "missing_reason": null
        }
      ]
    },
    {
      "item_id": "transition-review:cf432b507b89beae88e33b9a",
      "coverage": "full",
      "visual_evidence": [
        {
          "asset_id": "visual:9982bf2dbfff8828b6f14db6",
          "node_id": "event:atomic:memory:vh_seg_001:001",
          "roles": [
            "source"
          ],
          "video_id": "033fKtGdpPc",
          "start_s": 5.0,
          "end_s": 7.0,
          "media_url": "/api/media/visual:9982bf2dbfff8828b6f14db6",
          "availability": "available",
          "missing_reason": null
        },
        {
          "asset_id": "visual:870799f335ea6da23e6bbfb4",
          "node_id": "memory:vh_seg_001",
          "roles": [
            "observation"
          ],
          "video_id": "033fKtGdpPc",
          "start_s": 5.0,
          "end_s": 47.0,
          "media_url": "/api/media/visual:870799f335ea6da23e6bbfb4",
          "availability": "available",
          "missing_reason": null
        },
        {
          "asset_id": "visual:fd1968b281aeadfcf4b053cd",
          "node_id": "memory:vh_seg_002",
          "roles": [
            "observation"
          ],
          "video_id": "033fKtGdpPc",
          "start_s": 47.0,
          "end_s": 66.0,
          "media_url": "/api/media/visual:fd1968b281aeadfcf4b053cd",
          "availability": "available",
          "missing_reason": null
        },
        {
          "asset_id": "visual:90c711cbf3bfcdbaf16dedf0",
          "node_id": "memory:vh_seg_003",
          "roles": [
            "observation"
          ],
          "video_id": "033fKtGdpPc",
          "start_s": 66.0,
          "end_s": 104.0,
          "media_url": "/api/media/visual:90c711cbf3bfcdbaf16dedf0",
          "availability": "available",
          "missing_reason": null
        },
        {
          "asset_id": "visual:a59a83a2051f5b0c87f7ece9",
          "node_id": "memory:vh_seg_004",
          "roles": [
            "observation"
          ],
          "video_id": "033fKtGdpPc",
          "start_s": 105.0,
          "end_s": 135.0,
          "media_url": "/api/media/visual:a59a83a2051f5b0c87f7ece9",
          "availability": "available",
          "missing_reason": null
        },
        {
          "asset_id": "visual:0627bb904e1f264d1b4d531d",
          "node_id": "memory:vh_seg_005",
          "roles": [
            "observation"
          ],
          "video_id": "033fKtGdpPc",
          "start_s": 135.0,
          "end_s": 182.0,
          "media_url": "/api/media/visual:0627bb904e1f264d1b4d531d",
          "availability": "available",
          "missing_reason": null
        }
      ]
    },
    {
      "item_id": "transition-review:c3c95c3f80ff92bf153cf868",
      "coverage": "full",
      "visual_evidence": [
        {
          "asset_id": "visual:c65946cd117c4aa235d77ac7",
          "node_id": "event:atomic:memory:vh_seg_002:001",
          "roles": [
            "source"
          ],
          "video_id": "1IzpG2kJPdg",
          "start_s": 98.0,
          "end_s": 106.4,
          "media_url": "/api/media/visual:c65946cd117c4aa235d77ac7",
          "availability": "available",
          "missing_reason": null
        },
        {
          "asset_id": "visual:a42174973346c9e0a870748c",
          "node_id": "event:atomic:memory:vh_seg_002:006",
          "roles": [
            "target",
            "observation"
          ],
          "video_id": "1IzpG2kJPdg",
          "start_s": 140.0,
          "end_s": 148.4,
          "media_url": "/api/media/visual:a42174973346c9e0a870748c",
          "availability": "available",
          "missing_reason": null
        },
        {
          "asset_id": "visual:30c8516f54232466f6f0446b",
          "node_id": "memory:vh_seg_002",
          "roles": [
            "target",
            "observation"
          ],
          "video_id": "1IzpG2kJPdg",
          "start_s": 98.0,
          "end_s": 165.0,
          "media_url": "/api/media/visual:30c8516f54232466f6f0446b",
          "availability": "available",
          "missing_reason": null
        }
      ]
    },
    {
      "item_id": "transition-review:35dbd0ce63719ae99433291a",
      "coverage": "full",
      "visual_evidence": [
        {
          "asset_id": "visual:b26827674fcb19914c109c67",
          "node_id": "event:atomic:memory:vh_seg_001:004",
          "roles": [
            "source"
          ],
          "video_id": "-3l2KFTj7yY",
          "start_s": 6.0,